[
  {
    "schema_version": "1.0.0",
    "tenant_id": "default",
    "agent_run_id": "a1b2c3d4-0001-4a1a-8b2b-000000000001",
    "mcp_invocation_id": "a1b2c3d4-0002-4a1a-8b2b-000000000010",
    "trace_id": "0af7651916cd43dd8448eb211c80319c",
    "span_id": "1111111111110001",
    "parent_span_id": "b7ad6b7169203331",
    "server_name": "knowledge-base-mcp",
    "server_version": "1.2.0",
    "transport": "http",
    "protocol_version": "2025-06-18",
    "method": "tools/call",
    "tool_name": "search_policies",
    "tool_arguments": "{\"query\":\"refund window online orders\"}",
    "tool_result": "{\"hits\":2}",
    "permission_scope": "kb:read",
    "permission_changed": false,
    "sequence_index": 0,
    "latency_ms": 180,
    "status": "ok"
  },
  {
    "schema_version": "1.0.0",
    "tenant_id": "default",
    "agent_run_id": "a1b2c3d4-0001-4a1a-8b2b-000000000001",
    "mcp_invocation_id": "a1b2c3d4-0002-4a1a-8b2b-000000000011",
    "trace_id": "0af7651916cd43dd8448eb211c80319c",
    "span_id": "1111111111110002",
    "parent_span_id": "b7ad6b7169203331",
    "server_name": "crm-mcp",
    "server_version": "0.9.4",
    "transport": "stdio",
    "protocol_version": "2025-06-18",
    "method": "tools/call",
    "tool_name": "get_customer_tier",
    "tool_arguments": "{\"customer_id\":\"c-8842\"}",
    "tool_result": "{\"tier\":\"standard\"}",
    "permission_scope": "crm:read",
    "permission_changed": false,
    "sequence_index": 1,
    "latency_ms": 95,
    "status": "ok"
  },
  {
    "schema_version": "1.0.0",
    "tenant_id": "default",
    "agent_run_id": "a1b2c3d4-0001-4a1a-8b2b-000000000001",
    "mcp_invocation_id": "a1b2c3d4-0002-4a1a-8b2b-000000000012",
    "trace_id": "0af7651916cd43dd8448eb211c80319c",
    "span_id": "1111111111110003",
    "parent_span_id": "b7ad6b7169203331",
    "server_name": "policy-db-mcp",
    "server_version": "2.0.1",
    "transport": "http",
    "protocol_version": "2025-06-18",
    "method": "tools/call",
    "tool_name": "fetch_policy",
    "tool_arguments": "{\"policy_id\":\"refund-window\"}",
    "permission_scope": "policy:read",
    "permission_changed": true,
    "sequence_index": 2,
    "latency_ms": 5000,
    "status": "error",
    "error_type": "DeadlineExceeded",
    "error_message": "upstream policy-db did not respond within 5s",
    "failure_mode": "timeout"
  }
]
